{
  "week": "2026-W32",
  "start": "2026-08-03",
  "end": "2026-08-09",
  "summary": "CogniFlow can now repair and recover an existing installation through the same setup system used for installation. This gives failed or incomplete setups a clearer recovery path without requiring users to rebuild everything manually.",
  "areas": [
    "installation",
    "repair",
    "recovery"
  ],
  "contributors": [
    "gerrit"
  ]
}
