{
    "week":  "2025-W48",
    "start":  "2025-11-24",
    "end":  "2025-11-30",
    "summary":  "CogniFlow added stronger backend validation and plugin metadata schemas, making package compatibility checks clearer and reducing integration errors during setup and execution.",
    "areas":  [
                  "validation",
                  "package-management",
                  "developer-tooling"
              ],
    "contributors":  [
                         "gerrit"
                     ]
}
