{
    "week":  "2026-W07",
    "start":  "2026-02-09",
    "end":  "2026-02-15",
    "summary":  "CogniFlow introduced an initial pipeline-engine runtime scaffold with orchestration helpers, creating a stronger base for managed execution workflows.",
    "areas":  [
                  "workflow-orchestration",
                  "runtime-environment",
                  "developer-tooling"
              ],
    "contributors":  [
                         "gerrit",
                         "ricardo"
                     ]
}
