{
    "week":  "2025-W51",
    "start":  "2025-12-15",
    "end":  "2025-12-21",
    "summary":  "CogniFlow introduced ontology graph visualization and stricter SHACL-based constraints for processing steps, improving model transparency and semantic consistency.",
    "areas":  [
                  "knowledge-modeling",
                  "visualization",
                  "validation",
                  "workflow-design"
              ],
    "contributors":  [
                         "gerrit",
                         "ricardo"
                     ]
}
