{
    "week":  "2026-W15",
    "start":  "2026-04-06",
    "end":  "2026-04-12",
    "summary":  "CogniFlow improved topic semantics and ontology-driven views, making relationships between service concepts easier to understand for continued development.",
    "areas":  [
                  "knowledge-modeling",
                  "visualization",
                  "documentation"
              ],
    "contributors":  [
                         "gerrit"
                     ]
}
