{
  "week": "2026-W30",
  "start": "2026-07-20",
  "end": "2026-07-26",
  "summary": "CogniFlow can now organize its processing tools more clearly and select the components needed for different uses. This makes the platform easier to install and adapt to different laboratory and data-processing environments.",
  "areas": [
    "software-organization",
    "tool-selection",
    "installation",
    "adaptability"
  ],
  "contributors": [
    "gerrit"
  ]
}
