{
    "week":  "2026-W14",
    "start":  "2026-03-30",
    "end":  "2026-04-05",
    "summary":  "CogniFlow added an embedded workspace-store provider and expanded runtime APIs, making project state handling and service integration more practical.",
    "areas":  [
                  "storage",
                  "runtime-environment",
                  "application-connections"
              ],
    "contributors":  [
                         "gerrit",
                         "ricardo"
                     ]
}
